{"id":"RC:PLAN:0002","planning_object_type":"plan","name":{"zh-Hans":"待审测试规划","en":"Submitted Test Plan","ja":"審査待ちテスト計画"},"plan_id":null,"status":"SUBMITTED","version":1,"valid_from":"2030-03-01T00:00:00+08:00","valid_to":null,"target_ids":["RC:CITY:001"],"constraint_code":null,"provenance":{"source_type":"SYNTHETIC","source_ref":"S003 fixture","sensitivity":"SYNTHETIC_SAFE","generated_by":null,"random_seed":null,"notes":null}}