{"id":"RC:PLAN:0002","planning_object_type":"plan","name":{"zh-Hans":"待生效测试规划","en":"Approved Test Plan","ja":"発効待ちテスト計画"},"plan_id":null,"status":"APPROVED","version":1,"valid_from":"2030-03-01T00:00:00+08:00","valid_to":null,"target_ids":["RC:CITY:001"],"constraint_code":null,"provenance":{"source_type":"SYNTHETIC","source_ref":"S008 fixture","sensitivity":"SYNTHETIC_SAFE","generated_by":null,"random_seed":null,"notes":null}}