{"id":"RC:PLAN:0001","planning_object_type":"plan","name":{"zh-Hans":"并发测试规划","en":"Concurrency Test Plan","ja":"並行更新テスト計画"},"plan_id":null,"status":"EFFECTIVE","version":2,"valid_from":"2030-03-01T00:00:00+08:00","valid_to":null,"target_ids":["RC:CITY:001"],"constraint_code":null,"provenance":{"source_type":"SYNTHETIC","source_ref":"S010 fixture","sensitivity":"SYNTHETIC_SAFE","generated_by":null,"random_seed":null,"notes":null}}